{
  "run_id": "42-plan-1",
  "task_id": 42,
  "role": "coordinator",
  "command": "plan",
  "text": "Построить план выполнения задачи.",
  "context": {
    "task": {
      "id": 42,
      "title": "Возвращать код ошибки провайдера в ответе платежа",
      "text": "При отказе провайдера сервис онлайн-платежей возвращает общий код 500. Нужно возвращать код и сообщение провайдера в теле ответа.",
      "refs": ["jira:PAT-42"],
      "created_at": "2026-09-28T09:00:00+03:00"
    }
  }
}
